{"$id":"urn:hioc:pe4:association-lifecycle-clarification:1.0","$schema":"https://json-schema.org/draft/2020-12/schema","additionalProperties":false,"properties":{"active_cardinality":{"const":{"ha_device_id":1,"hioc_device_id":1}},"baseline_commit":{"const":"28f444edd7c62d178eb6981b1d6691e92e36c5b1"},"binding_history":{"const":"PRIVATE_REQUIRED"},"changes_asset_fields":{"const":false},"changes_canonical_ip":{"const":false},"changes_canonical_mac":{"const":false},"changes_health":{"const":false},"changes_hioc_identity":{"const":false},"changes_incidents":{"const":false},"changes_liveness":{"const":false},"contract_version":{"const":"1.0"},"credential_design_or_provisioning":{"const":"NOT_PERFORMED"},"credential_prerequisite":{"const":"HOME_ASSISTANT_RUNTIME_CREDENTIAL_PROVISIONING_LIKELY_SEPARATE_TO_BE_FINALIZED_BY_RESUMED_PREPARATION"},"cross_record_validation":{"const":["UNIQUE_ACTIVE_HIOC_IDS","UNIQUE_ACTIVE_HA_IDS","ONE_HIOC_TARGET_FOR_EVERY_ACTIVE_OR_HISTORICAL_HA_ID","UNIQUE_HISTORY_EPISODE_KEYS","FIRST_ASSOCIATED_LE_LAST_CONFIRMED_LT_RETIRED_LE_UPDATED_FOR_HISTORY","ACTIVE_LAST_CONFIRMED_EQUALS_UPDATED","PAIR_FIRST_ASSOCIATED_EQUALS_EARLIEST_KNOWN_PAIR_TIMESTAMP","STRICTLY_LATER_SUCCESSFUL_CYCLE_TIMESTAMP_THAN_PRIOR_UPDATED","HISTORY_APPEND_ONLY_EXCEPT_DEDUP_OF_IDENTICAL_EXISTING_EPISODE","ALL_UNCONFIRMED_PRIOR_ACTIVE_PAIRS_RETIRED_BEFORE_PUBLICATION","SUMMARY_COUNTS_EQUAL_VALIDATED_ARRAYS_AND_CURRENT_OUTCOMES","DIAGNOSTIC_REASON_UNIQUENESS","COMPLETE_VALIDATED_CANDIDATE_ATOMIC_REPLACEMENT"]},"diagnostic_semantics":{"const":{"ENTITY_WITHOUT_DEVICE_IDENTITY":"CURRENT_ENTITY_RECORDS_WITHOUT_PHYSICAL_DEVICE_MEMBERSHIP_NOT_DEVICE_REJECT_TOTAL","HA_DEVICE_ID_RECREATED":"SUCCESSFUL_SAFE_ID_ROTATIONS_IN_THIS_CYCLE","PRIOR_BINDING_RETIRED":"NEW_RETIREMENT_EPISODES_IN_THIS_SUCCESSFUL_CYCLE","existing_outcome_counts":"CURRENT_CYCLE_COUNTS_ONLY_PER_DECISION_DOMAIN","failure_diagnostics":"OPERATOR_SAFE_FAILURE_ONLY_NO_FAILED_CANDIDATE_STATE_PUBLICATION","privacy":"COUNT_ONLY_NO_PRIVATE_IDENTIFIERS"}},"failure_classes":{"const":["ACQUISITION","AUTHENTICATION","REQUIRED_COMMAND","COMPATIBILITY","SCHEMA","CANONICAL_INVENTORY_INPUT","CANDIDATE_VALIDATION","PUBLICATION","BINDING_HISTORY_CAPACITY_EXCEEDED"]},"failure_policy":{"const":"PRESERVE_ENTIRE_LAST_KNOWN_GOOD_STATE"},"generic_integration_ingestion":{"const":"PROHIBITED"},"historical_ha_id_rule":{"const":"ONE_HIOC_IDENTITY_FOREVER_NO_AUTOMATIC_REBIND"},"history_is_matching_heuristic":{"const":false},"history_policy":{"const":{"automatic_eviction":false,"capacity_exceeded":"BINDING_HISTORY_CAPACITY_EXCEEDED","capacity_failure":"PRESERVE_ENTIRE_LAST_KNOWN_GOOD_STATE","duplicate_episode":"PRESERVE_EXISTING_RECORD_AND_ORIGINAL_RETIRED_AT_AND_REASON","episode_key":["ha_device_id","hioc_device_id","last_confirmed_at"],"episode_timestamp_comparison":"PARSED_UTC_INSTANT_NOT_TIMESTAMP_SPELLING","history_records_after_reactivation":"RETAIN_PREVIOUS_RETIREMENT_EPISODES_AS_PRIVATE_PAST_EVENTS","max_records":4096,"new_episode":"ONLY_AFTER_SUCCESSFUL_REACTIVATION_WITH_LATER_LAST_CONFIRMED_AT","ordering":["ha_device_id","hioc_device_id","last_confirmed_at"],"pair_first_timestamp":"SAME_EARLIEST_PAIR_INSTANT_ACROSS_ALL_ACTIVE_AND_HISTORICAL_EPISODES","pruning":"SEPARATE_FUTURE_GOVERNANCE_ONLY","record_fields":["hioc_device_id","ha_device_id","first_associated_at","last_confirmed_at","retired_at","retirement_reason"]}},"history_prohibited_fields":{"const":["mac","ip","hostname","entity_id","unique_id","config_entry_id","area_name","device_name","serial_number","configuration_url","raw_registry_values","credentials","arbitrary_ha_identifiers"]},"identity_engine":{"const":"HIOC_ONLY"},"implementation_preparation":{"const":"NOT_STARTED"},"last_confirmed_at":{"const":"SUCCESSFUL_STRONG_IDENTITY_RECONFIRMATION_NOT_LIVENESS_AVAILABILITY_OR_HEALTH"},"lifecycle_state":{"const":"PASS_CLOSED"},"next_checkpoint":{"const":"PE-4 Home Assistant Association Adapter Implementation Preparation"},"original_0c_contract_path":{"const":"governance/pe4/pe4-0c-association-contract.json"},"original_0c_contract_sha256":{"const":"a48ec696c7e596dde68e252366f84ea46dfa7076a9b1aaff419a993742ed9a58"},"original_state_schema_path":{"const":"governance/pe4/pe4-home-assistant-association-state.schema.json"},"original_state_schema_sha256":{"const":"0a85d0e16f8d27f6532846e00eed843915b06ed2a3b84fd74285d931f3e6892d"},"pe4":{"const":"NOT_COMPLETE"},"pe4_0b2b":{"const":"PASS_CLOSED"},"pe4_0c":{"const":"PASS_CLOSED"},"phase_7a":{"const":"ACTIVE"},"prior_binding_conflict":{"const":"REJECT_PRIOR_BINDING_CONFLICT"},"prior_conflict_is_completed_replacement":{"const":false},"private_state_path":{"const":"state/inventory/associations/home_assistant.json"},"production_state":{"const":"NOT_CREATED"},"public_projection":{"const":"CURRENT_ACTIVE_ONLY_HISTORY_NEVER_ASSOCIATED_TRUE_DEFERRED_IMPLEMENTATION"},"reactivation":{"const":{"different_hioc_id":"REJECT_PRIOR_BINDING_CONFLICT","first_associated_at":"EARLIEST_SUCCESSFUL_TIMESTAMP_OF_EXACT_HA_ID_HIOC_ID_PAIR","history_retained":true,"last_confirmed_at":"CURRENT_SUCCESSFUL_CYCLE_PUBLICATION_TIME","requires":"COMPLETE_0C_STRONG_RULE_AND_SAME_HISTORICAL_HIOC_ID"}},"record_type":{"const":"PE4_0C1_ASSOCIATION_LIFECYCLE_CLARIFICATION"},"recreation_already_retired_source":{"const":"PRESERVE_EXISTING_EPISODE_REASON_AND_RETIRED_AT; COUNT_CURRENT_SAFE_ROTATION_WITHOUT_DUPLICATE_RETIREMENT"},"recreation_conditions":{"const":["OLD_PREVIOUSLY_STRONG_PAIR_EXISTS_FOR_TARGET_HIOC_ID","OLD_HA_ID_ABSENT_FROM_COMPLETE_CURRENT_DEVICE_RESPONSE","NEW_HA_ID_EXACTLY_ONE_DISTINCT_VALID_NORMALIZED_MAC_NO_INVALID_EVIDENCE","MAC_GLOBALLY_UNIQUE_IN_CURRENT_HA_RESPONSE","MAC_MAPS_TO_EXACTLY_ONE_CANONICAL_HIOC_DEVICE","TARGET_IS_SAME_HISTORICAL_HIOC_STABLE_ID","NEW_HA_ID_HAS_NO_HISTORY_TO_OTHER_HIOC_ID","NO_OTHER_CURRENT_ACTIVE_HA_ID_TO_TARGET_HIOC_ID","NO_COMPETING_CURRENT_HA_DEVICE_WITH_MAC","NO_HIOC_MAC_AMBIGUITY"]},"recreation_new_pair_first_associated_at":{"const":"CURRENT_SUCCESSFUL_CYCLE_PUBLICATION_TIME"},"recreation_old_present":{"const":"PROHIBITED"},"recreation_prior_pair_selection":{"const":"PREVIOUS_ACTIVE_PAIR_ELSE_MOST_RECENT_HISTORICAL_PAIR_BY_LAST_CONFIRMED_AT; TIED_DISTINCT_HA_IDS_REQUIRE_REVIEW"},"relationship_incomplete":{"const":"KEEP_RECONFIRMED_STRONG_ASSOCIATION_SET_INCOMPLETE_NO_FABRICATED_LINKS"},"retirement_precedence":{"const":["HA_DEVICE_ABSENT","HA_DEVICE_INVALID_MAC","HA_DEVICE_NO_MAC","HA_DEVICE_MULTIPLE_MAC","HA_DEVICE_MAC_COLLISION","HIOC_DEVICE_ABSENT","HIOC_MAC_AMBIGUITY","HIOC_CANONICAL_MAC_NO_LONGER_MATCHES"]},"retirement_reason_enum":{"const":["HA_DEVICE_ABSENT","HA_DEVICE_NO_MAC","HA_DEVICE_INVALID_MAC","HA_DEVICE_MULTIPLE_MAC","HA_DEVICE_MAC_COLLISION","HIOC_DEVICE_ABSENT","HIOC_CANONICAL_MAC_NO_LONGER_MATCHES","HA_DEVICE_RECREATED","HIOC_MAC_AMBIGUITY"]},"rollback":{"const":"NOT_PERFORMED"},"runtime_adapter":{"const":"NOT_IMPLEMENTED"},"safe_ha_device_id_recreation":{"const":"CONDITIONALLY_ALLOWED_SAME_HIOC_IDENTITY"},"safe_recreation_overrides_absence_reason":{"const":"HA_DEVICE_RECREATED"},"schema_version":{"const":"1.0"},"silent_rebinding":{"const":"PROHIBITED"},"state_schema_path":{"const":"governance/pe4/pe4-home-assistant-association-state-v1.1.schema.json"},"state_schema_sha256":{"const":"5cd060ffd0a7a2e0a2b3e61da50ec8e5a418f4251df7305f713c10701b0e6a5d"},"state_schema_version":{"const":"1.1"},"status":{"const":"FROZEN"},"stopped_preparation":{"const":"CORRECTLY_STOPPED_NO_CHANGES_NO_CLOSURE"},"success_snapshot_active_policy":{"const":"CURRENTLY_RECONFIRMED_STRONG_ASSOCIATIONS_ONLY"},"successful_retirement_rules":{"const":{"HA_DEVICE_ABSENT":"HA_DEVICE_ABSENT","HA_DEVICE_INVALID_MAC":"HA_DEVICE_INVALID_MAC","HA_DEVICE_MAC_COLLISION":"HA_DEVICE_MAC_COLLISION","HA_DEVICE_MULTIPLE_MAC":"HA_DEVICE_MULTIPLE_MAC","HA_DEVICE_NO_MAC":"HA_DEVICE_NO_MAC","HIOC_CANONICAL_MAC_NO_LONGER_MATCHES":"HIOC_CANONICAL_MAC_NO_LONGER_MATCHES","HIOC_DEVICE_ABSENT":"HIOC_DEVICE_ABSENT","HIOC_MAC_AMBIGUITY":"HIOC_MAC_AMBIGUITY"}},"summary_semantics":{"const":{"associated_devices":"LENGTH_OF_CURRENT_ACTIVE_ASSOCIATIONS","entity_memberships":"SUM_OF_RETAINED_ENTITY_REFERENCES_IN_CURRENT_ACTIVE_ASSOCIATIONS","historical_bindings":"LENGTH_OF_BINDING_HISTORY_RETIREMENT_EPISODES","rejected":"CURRENT_HA_DEVICE_REJECT_OUTCOMES_EACH_DEVICE_COUNTED_ONCE","review_only":"CURRENT_HA_DEVICE_OUTCOMES_REVIEW_ONLY_NO_MAC_OR_REVIEW_ONLY_MULTIPLE_MAC","unmatched":"CURRENT_HA_DEVICE_OUTCOME_UNMATCHED_STRONG_EVIDENCE"}},"updated_at":{"const":"SUCCESSFUL_PRIVATE_SNAPSHOT_PUBLICATION_TIME"},"writer_locking_finding":{"const":"STATESTORE_WRITE_JSON_ALONE_INSUFFICIENT_LOCKING_NOFOLLOW_OWNERSHIP_DURABILITY; RESUMED_PREPARATION_MUST_FINISH_DESIGN"}},"required":["active_cardinality","baseline_commit","binding_history","changes_asset_fields","changes_canonical_ip","changes_canonical_mac","changes_health","changes_hioc_identity","changes_incidents","changes_liveness","contract_version","credential_design_or_provisioning","credential_prerequisite","cross_record_validation","diagnostic_semantics","failure_classes","failure_policy","generic_integration_ingestion","historical_ha_id_rule","history_is_matching_heuristic","history_policy","history_prohibited_fields","identity_engine","implementation_preparation","last_confirmed_at","lifecycle_state","next_checkpoint","original_0c_contract_path","original_0c_contract_sha256","original_state_schema_path","original_state_schema_sha256","pe4","pe4_0b2b","pe4_0c","phase_7a","prior_binding_conflict","prior_conflict_is_completed_replacement","private_state_path","production_state","public_projection","reactivation","record_type","recreation_already_retired_source","recreation_conditions","recreation_new_pair_first_associated_at","recreation_old_present","recreation_prior_pair_selection","relationship_incomplete","retirement_precedence","retirement_reason_enum","rollback","runtime_adapter","safe_ha_device_id_recreation","safe_recreation_overrides_absence_reason","schema_version","silent_rebinding","state_schema_path","state_schema_sha256","state_schema_version","status","stopped_preparation","success_snapshot_active_policy","successful_retirement_rules","summary_semantics","updated_at","writer_locking_finding"],"title":"Frozen PE-4.0C.1 lifecycle clarification","type":"object"}
