{"active_cardinality":{"ha_device_id":1,"hioc_device_id":1},"baseline_commit":"28f444edd7c62d178eb6981b1d6691e92e36c5b1","binding_history":"PRIVATE_REQUIRED","changes_asset_fields":false,"changes_canonical_ip":false,"changes_canonical_mac":false,"changes_health":false,"changes_hioc_identity":false,"changes_incidents":false,"changes_liveness":false,"contract_version":"1.0","credential_design_or_provisioning":"NOT_PERFORMED","credential_prerequisite":"HOME_ASSISTANT_RUNTIME_CREDENTIAL_PROVISIONING_LIKELY_SEPARATE_TO_BE_FINALIZED_BY_RESUMED_PREPARATION","cross_record_validation":["UNIQUE_ACTIVE_HIOC_IDS","UNIQUE_ACTIVE_HA_IDS","ONE_HIOC_TARGET_FOR_EVERY_ACTIVE_OR_HISTORICAL_HA_ID","UNIQUE_HISTORY_EPISODE_KEYS","FIRST_ASSOCIATED_LE_LAST_CONFIRMED_LT_RETIRED_LE_UPDATED_FOR_HISTORY","ACTIVE_LAST_CONFIRMED_EQUALS_UPDATED","PAIR_FIRST_ASSOCIATED_EQUALS_EARLIEST_KNOWN_PAIR_TIMESTAMP","STRICTLY_LATER_SUCCESSFUL_CYCLE_TIMESTAMP_THAN_PRIOR_UPDATED","HISTORY_APPEND_ONLY_EXCEPT_DEDUP_OF_IDENTICAL_EXISTING_EPISODE","ALL_UNCONFIRMED_PRIOR_ACTIVE_PAIRS_RETIRED_BEFORE_PUBLICATION","SUMMARY_COUNTS_EQUAL_VALIDATED_ARRAYS_AND_CURRENT_OUTCOMES","DIAGNOSTIC_REASON_UNIQUENESS","COMPLETE_VALIDATED_CANDIDATE_ATOMIC_REPLACEMENT"],"diagnostic_semantics":{"ENTITY_WITHOUT_DEVICE_IDENTITY":"CURRENT_ENTITY_RECORDS_WITHOUT_PHYSICAL_DEVICE_MEMBERSHIP_NOT_DEVICE_REJECT_TOTAL","HA_DEVICE_ID_RECREATED":"SUCCESSFUL_SAFE_ID_ROTATIONS_IN_THIS_CYCLE","PRIOR_BINDING_RETIRED":"NEW_RETIREMENT_EPISODES_IN_THIS_SUCCESSFUL_CYCLE","existing_outcome_counts":"CURRENT_CYCLE_COUNTS_ONLY_PER_DECISION_DOMAIN","failure_diagnostics":"OPERATOR_SAFE_FAILURE_ONLY_NO_FAILED_CANDIDATE_STATE_PUBLICATION","privacy":"COUNT_ONLY_NO_PRIVATE_IDENTIFIERS"},"failure_classes":["ACQUISITION","AUTHENTICATION","REQUIRED_COMMAND","COMPATIBILITY","SCHEMA","CANONICAL_INVENTORY_INPUT","CANDIDATE_VALIDATION","PUBLICATION","BINDING_HISTORY_CAPACITY_EXCEEDED"],"failure_policy":"PRESERVE_ENTIRE_LAST_KNOWN_GOOD_STATE","generic_integration_ingestion":"PROHIBITED","historical_ha_id_rule":"ONE_HIOC_IDENTITY_FOREVER_NO_AUTOMATIC_REBIND","history_is_matching_heuristic":false,"history_policy":{"automatic_eviction":false,"capacity_exceeded":"BINDING_HISTORY_CAPACITY_EXCEEDED","capacity_failure":"PRESERVE_ENTIRE_LAST_KNOWN_GOOD_STATE","duplicate_episode":"PRESERVE_EXISTING_RECORD_AND_ORIGINAL_RETIRED_AT_AND_REASON","episode_key":["ha_device_id","hioc_device_id","last_confirmed_at"],"episode_timestamp_comparison":"PARSED_UTC_INSTANT_NOT_TIMESTAMP_SPELLING","history_records_after_reactivation":"RETAIN_PREVIOUS_RETIREMENT_EPISODES_AS_PRIVATE_PAST_EVENTS","max_records":4096,"new_episode":"ONLY_AFTER_SUCCESSFUL_REACTIVATION_WITH_LATER_LAST_CONFIRMED_AT","ordering":["ha_device_id","hioc_device_id","last_confirmed_at"],"pair_first_timestamp":"SAME_EARLIEST_PAIR_INSTANT_ACROSS_ALL_ACTIVE_AND_HISTORICAL_EPISODES","pruning":"SEPARATE_FUTURE_GOVERNANCE_ONLY","record_fields":["hioc_device_id","ha_device_id","first_associated_at","last_confirmed_at","retired_at","retirement_reason"]},"history_prohibited_fields":["mac","ip","hostname","entity_id","unique_id","config_entry_id","area_name","device_name","serial_number","configuration_url","raw_registry_values","credentials","arbitrary_ha_identifiers"],"identity_engine":"HIOC_ONLY","implementation_preparation":"NOT_STARTED","last_confirmed_at":"SUCCESSFUL_STRONG_IDENTITY_RECONFIRMATION_NOT_LIVENESS_AVAILABILITY_OR_HEALTH","lifecycle_state":"PASS_CLOSED","next_checkpoint":"PE-4 Home Assistant Association Adapter Implementation Preparation","original_0c_contract_path":"governance/pe4/pe4-0c-association-contract.json","original_0c_contract_sha256":"a48ec696c7e596dde68e252366f84ea46dfa7076a9b1aaff419a993742ed9a58","original_state_schema_path":"governance/pe4/pe4-home-assistant-association-state.schema.json","original_state_schema_sha256":"0a85d0e16f8d27f6532846e00eed843915b06ed2a3b84fd74285d931f3e6892d","pe4":"NOT_COMPLETE","pe4_0b2b":"PASS_CLOSED","pe4_0c":"PASS_CLOSED","phase_7a":"ACTIVE","prior_binding_conflict":"REJECT_PRIOR_BINDING_CONFLICT","prior_conflict_is_completed_replacement":false,"private_state_path":"state/inventory/associations/home_assistant.json","production_state":"NOT_CREATED","public_projection":"CURRENT_ACTIVE_ONLY_HISTORY_NEVER_ASSOCIATED_TRUE_DEFERRED_IMPLEMENTATION","reactivation":{"different_hioc_id":"REJECT_PRIOR_BINDING_CONFLICT","first_associated_at":"EARLIEST_SUCCESSFUL_TIMESTAMP_OF_EXACT_HA_ID_HIOC_ID_PAIR","history_retained":true,"last_confirmed_at":"CURRENT_SUCCESSFUL_CYCLE_PUBLICATION_TIME","requires":"COMPLETE_0C_STRONG_RULE_AND_SAME_HISTORICAL_HIOC_ID"},"record_type":"PE4_0C1_ASSOCIATION_LIFECYCLE_CLARIFICATION","recreation_already_retired_source":"PRESERVE_EXISTING_EPISODE_REASON_AND_RETIRED_AT; COUNT_CURRENT_SAFE_ROTATION_WITHOUT_DUPLICATE_RETIREMENT","recreation_conditions":["OLD_PREVIOUSLY_STRONG_PAIR_EXISTS_FOR_TARGET_HIOC_ID","OLD_HA_ID_ABSENT_FROM_COMPLETE_CURRENT_DEVICE_RESPONSE","NEW_HA_ID_EXACTLY_ONE_DISTINCT_VALID_NORMALIZED_MAC_NO_INVALID_EVIDENCE","MAC_GLOBALLY_UNIQUE_IN_CURRENT_HA_RESPONSE","MAC_MAPS_TO_EXACTLY_ONE_CANONICAL_HIOC_DEVICE","TARGET_IS_SAME_HISTORICAL_HIOC_STABLE_ID","NEW_HA_ID_HAS_NO_HISTORY_TO_OTHER_HIOC_ID","NO_OTHER_CURRENT_ACTIVE_HA_ID_TO_TARGET_HIOC_ID","NO_COMPETING_CURRENT_HA_DEVICE_WITH_MAC","NO_HIOC_MAC_AMBIGUITY"],"recreation_new_pair_first_associated_at":"CURRENT_SUCCESSFUL_CYCLE_PUBLICATION_TIME","recreation_old_present":"PROHIBITED","recreation_prior_pair_selection":"PREVIOUS_ACTIVE_PAIR_ELSE_MOST_RECENT_HISTORICAL_PAIR_BY_LAST_CONFIRMED_AT; TIED_DISTINCT_HA_IDS_REQUIRE_REVIEW","relationship_incomplete":"KEEP_RECONFIRMED_STRONG_ASSOCIATION_SET_INCOMPLETE_NO_FABRICATED_LINKS","retirement_precedence":["HA_DEVICE_ABSENT","HA_DEVICE_INVALID_MAC","HA_DEVICE_NO_MAC","HA_DEVICE_MULTIPLE_MAC","HA_DEVICE_MAC_COLLISION","HIOC_DEVICE_ABSENT","HIOC_MAC_AMBIGUITY","HIOC_CANONICAL_MAC_NO_LONGER_MATCHES"],"retirement_reason_enum":["HA_DEVICE_ABSENT","HA_DEVICE_NO_MAC","HA_DEVICE_INVALID_MAC","HA_DEVICE_MULTIPLE_MAC","HA_DEVICE_MAC_COLLISION","HIOC_DEVICE_ABSENT","HIOC_CANONICAL_MAC_NO_LONGER_MATCHES","HA_DEVICE_RECREATED","HIOC_MAC_AMBIGUITY"],"rollback":"NOT_PERFORMED","runtime_adapter":"NOT_IMPLEMENTED","safe_ha_device_id_recreation":"CONDITIONALLY_ALLOWED_SAME_HIOC_IDENTITY","safe_recreation_overrides_absence_reason":"HA_DEVICE_RECREATED","schema_version":"1.0","silent_rebinding":"PROHIBITED","state_schema_path":"governance/pe4/pe4-home-assistant-association-state-v1.1.schema.json","state_schema_sha256":"5cd060ffd0a7a2e0a2b3e61da50ec8e5a418f4251df7305f713c10701b0e6a5d","state_schema_version":"1.1","status":"FROZEN","stopped_preparation":"CORRECTLY_STOPPED_NO_CHANGES_NO_CLOSURE","success_snapshot_active_policy":"CURRENTLY_RECONFIRMED_STRONG_ASSOCIATIONS_ONLY","successful_retirement_rules":{"HA_DEVICE_ABSENT":"HA_DEVICE_ABSENT","HA_DEVICE_INVALID_MAC":"HA_DEVICE_INVALID_MAC","HA_DEVICE_MAC_COLLISION":"HA_DEVICE_MAC_COLLISION","HA_DEVICE_MULTIPLE_MAC":"HA_DEVICE_MULTIPLE_MAC","HA_DEVICE_NO_MAC":"HA_DEVICE_NO_MAC","HIOC_CANONICAL_MAC_NO_LONGER_MATCHES":"HIOC_CANONICAL_MAC_NO_LONGER_MATCHES","HIOC_DEVICE_ABSENT":"HIOC_DEVICE_ABSENT","HIOC_MAC_AMBIGUITY":"HIOC_MAC_AMBIGUITY"},"summary_semantics":{"associated_devices":"LENGTH_OF_CURRENT_ACTIVE_ASSOCIATIONS","entity_memberships":"SUM_OF_RETAINED_ENTITY_REFERENCES_IN_CURRENT_ACTIVE_ASSOCIATIONS","historical_bindings":"LENGTH_OF_BINDING_HISTORY_RETIREMENT_EPISODES","rejected":"CURRENT_HA_DEVICE_REJECT_OUTCOMES_EACH_DEVICE_COUNTED_ONCE","review_only":"CURRENT_HA_DEVICE_OUTCOMES_REVIEW_ONLY_NO_MAC_OR_REVIEW_ONLY_MULTIPLE_MAC","unmatched":"CURRENT_HA_DEVICE_OUTCOME_UNMATCHED_STRONG_EVIDENCE"},"updated_at":"SUCCESSFUL_PRIVATE_SNAPSHOT_PUBLICATION_TIME","writer_locking_finding":"STATESTORE_WRITE_JSON_ALONE_INSUFFICIENT_LOCKING_NOFOLLOW_OWNERSHIP_DURABILITY; RESUMED_PREPARATION_MUST_FINISH_DESIGN"}
